Cites,Authors,Title,Year,Source,Publisher,ArticleURL,CitesURL,GSRank,QueryDate,Type,DOI,ISSN,CitationURL,Volume,Issue,StartPage,EndPage,ECC,CitesPerYear,CitesPerAuthor,AuthorCount,Age,Abstract,FullTextURL,RelatedURL
54,"MD McGee, SR Borstein, JI Meier, DA Marques…","The ecological and genomic basis of explosive adaptive radiation",2020,"Nature","nature.com","https://www.nature.com/articles/s41586-020-2652-7","https://scholar.google.com/scholar?cites=13945942443905589161&as_sdt=2005&sciodt=2007&hl=en",1,"2021-11-11 22:23:06","","","","",,,,,54,54.00,11,5,1,"Speciation rates vary considerably among lineages, and our understanding of what drives the rapid succession of speciation events within young adaptive radiations remains …","https://www.eawag.ch/fileadmin/Domain1/Abteilungen/fishec/Publikationen/2020/McGee_et_al_2020_Nature.pdf","https://scholar.google.com/scholar?q=related:qR8Jk8PwicEJ:scholar.google.com/&scioq=author:%22mary+kishe%22&hl=en&as_sdt=2007"
9,"C Xiong, Z Guo, SS Chen, Q Gao, MA Kishe…","Understanding the pathway of phosphorus metabolism in urban household consumption system: A case study of Dar es Salaam, Tanzania",2020,"Journal of Cleaner …","Elsevier","https://www.sciencedirect.com/science/article/pii/S095965262032919X","https://scholar.google.com/scholar?cites=15126954226907087481&as_sdt=2005&sciodt=2007&hl=en",2,"2021-11-11 22:23:06","","","","",,,,,9,9.00,2,6,1,"Phosphorus discharge in urban household consumption system has an important impact on the urban ecological environment, especially the surface water environment. In this study, a …","","https://scholar.google.com/scholar?q=related:eQJkLLm87dEJ:scholar.google.com/&scioq=author:%22mary+kishe%22&hl=en&as_sdt=2007"
5,"RC Blackman, A Bruder, FJ Burdon, P Convey…","A meeting framework for inclusive and sustainable science",2020,"Nature ecology & …","nature.com","https://www.nature.com/articles/s41559-020-1190-x","https://scholar.google.com/scholar?cites=11051271835212327990&as_sdt=2005&sciodt=2007&hl=en",3,"2021-11-11 22:23:06","HTML","","","",,,,,5,5.00,1,5,1,"Conferences are, next to publications in scientific journals, the most commonly used format to present and disseminate recent advances in scientific research. Conferences are also …","https://www.nature.com/articles/s41559-020-1190-x","https://scholar.google.com/scholar?q=related:Niwcli4BXpkJ:scholar.google.com/&scioq=author:%22mary+kishe%22&hl=en&as_sdt=2007"
3,"V Natugonza, L Musinguzi, MA Kishe…","The consequences of anthropogenic stressors on cichlid fish communities: revisiting Lakes Victoria, Kyoga, and Nabugabo",2021,"The Behavior, Ecology …","Springer","https://link.springer.com/chapter/10.1007/978-94-024-2080-7_7","https://scholar.google.com/scholar?cites=16020350862580536697&as_sdt=2005&sciodt=2007&hl=en",4,"2021-11-11 22:23:06","","10.1007/978-94-024-2080-7_7","","",,,,,3,3.00,1,4,1,"Abstract Lakes Victoria, Kyoga, and Nabugabo (“the Lake Victoria region”) are remarkable for hosting one of the largest assemblages of cichlid fishes among the African inland lakes …","",""
2,"JC Rijssel, R Jong, MA Kishe, F Witte","Rapid evolutionary responses in cichlids: genetics of adaptation, morphology and taxonomic Implications",2021,"The Behavior, Ecology and …","Springer","https://link.springer.com/chapter/10.1007/978-94-024-2080-7_8","https://scholar.google.com/scholar?cites=7913982650126418353&as_sdt=2005&sciodt=2007&hl=en",5,"2021-11-11 22:23:06","","10.1007/978-94-024-2080-7_8","","",,,,,2,2.00,1,4,1,"The haplochromine cichlids of Lake Victoria exhibit the fastest adaptive radiation of vertebrates known. Species identification of these lacustrine cichlids has been subject of …","",""
78,"AS Downing, EH van Nes, JS Balirwa, J Beuving…","Coupled human and natural system dynamics as key to the sustainability of Lake Victoria's ecosystem services",2014,"Ecology and …","JSTOR","https://www.jstor.org/stable/26269672","https://scholar.google.com/scholar?cites=11232955591706652483&as_sdt=2005&sciodt=2007&hl=en",6,"2021-11-11 22:23:06","","","","",,,,,78,11.14,16,5,7,"East Africa's Lake Victoria provides resources and services to millions of people on the lake's shores and abroad. In particular, the lake's fisheries are an important source of …","https://www.jstor.org/stable/pdf/26269672.pdf","https://scholar.google.com/scholar?q=related:Q69pjZh545sJ:scholar.google.com/&scioq=author:%22mary+kishe%22&hl=en&as_sdt=2007"
33,"SM Limbu, AP Shoko, HA Lamtane…","Fish polyculture system integrated with vegetable farming improves yield and economic benefits of small‐scale farmers",2017,"Aquaculture …","Wiley Online Library","https://onlinelibrary.wiley.com/doi/abs/10.1111/are.13188","https://scholar.google.com/scholar?cites=4218186252898946703&as_sdt=2005&sciodt=2007&hl=en",7,"2021-11-11 22:23:06","","10.1111/are.13188","","",,,,,33,8.25,8,4,4,"This study explored the yield and economic benefits of African sharptooth catfish, Clarias gariepinus, and Nile tilapia, Oreochromis niloticus polyculture, reared in earthen ponds for …","https://onlinelibrary.wiley.com/doi/pdfdirect/10.1111/are.13188","https://scholar.google.com/scholar?q=related:j056UAwCijoJ:scholar.google.com/&scioq=author:%22mary+kishe%22&hl=en&as_sdt=2007"
49,"MA Kishe-Machumu, F Witte, JH Wanink, EFB Katunzi","The diet of Nile perch, Lates niloticus (L.) after resurgence of haplochromine cichlids in the Mwanza Gulf of Lake Victoria",2012,"Hydrobiologia","Springer","https://link.springer.com/article/10.1007/s10750-011-0822-1","https://scholar.google.com/scholar?cites=17886463848470754010&as_sdt=2005&sciodt=2007&hl=en",8,"2021-11-11 22:23:06","HTML","10.1007/s10750-011-0822-1","","",,,,,49,5.44,12,4,9,"Haplochromine cichlids used to be the main prey of the introduced Nile perch, Lates niloticus, in Lake Victoria. After depletion of the haplochromine stocks at the end of the …","https://link.springer.com/article/10.1007/s10750-011-0822-1","https://scholar.google.com/scholar?q=related:2jL3hxp8OfgJ:scholar.google.com/&scioq=author:%22mary+kishe%22&hl=en&as_sdt=2007"
49,"J Wanink, F Witte, M Kishe-Machumu","Dietary shift in benthivorous cichlids after the ecological changes in Lake Victoria",2008,"Animal Biology","brill.com","https://brill.com/view/journals/ab/58/4/article-p401_6.xml","https://scholar.google.com/scholar?cites=16398916159760354632&as_sdt=2005&sciodt=2007&hl=en",9,"2021-11-11 22:23:06","","","","",,,,,49,3.77,16,3,13,"Abstract Cichlid fishes of Lake Victoria are well known for their trophic specializations. In our study area, the sub-littoral waters of the Mwanza Gulf (Tanzania), at least 12 trophic groups …","https://www.academia.edu/download/46354889/Dietary_shift_in_benthivorous_cichlids_a20160608-23459-1d4eybr.pdf","https://scholar.google.com/scholar?q=related:SM3ts1ynlOMJ:scholar.google.com/&scioq=author:%22mary+kishe%22&hl=en&as_sdt=2007"
33,"F Witte, O Seehausen, JH Wanink…","Cichlid species diversity in naturally and anthropogenically turbid habitats of Lake Victoria, East Africa",2013,"Aquatic Sciences","Springer","https://link.springer.com/content/pdf/10.1007/s00027-012-0265-4.pdf","https://scholar.google.com/scholar?cites=6415311686320763564&as_sdt=2005&sciodt=2007&hl=en",10,"2021-11-11 22:23:06","PDF","10.1007/s00027-012-0265-4","","",,,,,33,4.13,8,4,8,"During the past decades, major anthropogenic environmental changes occurred in Lake Victoria, including increased predation pressure due to Nile perch introduction, and …","https://link.springer.com/content/pdf/10.1007/s00027-012-0265-4.pdf","https://scholar.google.com/scholar?q=related:rLKPKv3DB1kJ:scholar.google.com/&scioq=author:%22mary+kishe%22&hl=en&as_sdt=2007"
26,"JC van Rijssel, ES Hoogwater, MA Kishe‐Machumu…","Fast adaptive responses in the oral jaw of Lake Victoria cichlids",2015,"…","Wiley Online Library","https://onlinelibrary.wiley.com/doi/abs/10.1111/evo.12561","https://scholar.google.com/scholar?cites=16952300489125008530&as_sdt=2005&sciodt=2007&hl=en",11,"2021-11-11 22:23:06","","10.1111/evo.12561","","",,,,,26,4.33,7,4,6,"Rapid morphological changes in response to fluctuating natural environments are a common phenomenon in species that undergo adaptive radiation. The dramatic ecological …","https://onlinelibrary.wiley.com/doi/pdf/10.1111/evo.12561","https://scholar.google.com/scholar?q=related:khT6S3qrQusJ:scholar.google.com/&scioq=author:%22mary+kishe%22&hl=en&as_sdt=2007"
17,"MA Kishe-Machumu, JC van Rijssel, A Poste…","Stable isotope evidence from formalin–ethanol-preserved specimens indicates dietary shifts and increasing diet overlap in Lake Victoria cichlids",2017,"Hydrobiologia","Springer","https://link.springer.com/content/pdf/10.1007/s10750-016-2925-1.pdf","https://scholar.google.com/scholar?cites=3725709453791468189&as_sdt=2005&sciodt=2007&hl=en",12,"2021-11-11 22:23:06","PDF","10.1007/s10750-016-2925-1","","",,,,,17,4.25,4,4,4,"Stable isotopes are increasingly being used to infer past and present trophic interactions in light of environmental changes. The Lake Victoria haplochromine cichlids have experienced …","https://link.springer.com/content/pdf/10.1007/s10750-016-2925-1.pdf","https://scholar.google.com/scholar?q=related:nRqOMQJhtDMJ:scholar.google.com/&scioq=author:%22mary+kishe%22&hl=en&as_sdt=2007"
17,"SM Limbu, AP Shoko, HA Lamtane, ED Shirima…","Effect of initial stocking size of the predatory African sharptooth catfish (Clarias gariepinu s) on recruits, growth performance, survival and yield of mixed-sex …",2015,"International Aquatic …","Springer","https://link.springer.com/article/10.1007/s40071-014-0093-3","https://scholar.google.com/scholar?cites=863379595084430437&as_sdt=2005&sciodt=2007&hl=en",13,"2021-11-11 22:23:06","HTML","10.1007/s40071-014-0093-3","","",,,,,17,2.83,3,5,6,"Prolific breeding and production of high percentage of recruits are main problems in mixed-sex Nile tilapia (Oreochromis niloticus) culture in earthen ponds. The current study assessed …","https://link.springer.com/article/10.1007/s40071-014-0093-3","https://scholar.google.com/scholar?q=related:ZfxT1ypX-wsJ:scholar.google.com/&scioq=author:%22mary+kishe%22&hl=en&as_sdt=2007"
22,"JC van Rijssel, RE Hecky, MA Kishe-Machumu, F Witte","Changing ecology of Lake Victoria cichlids and their environment: evidence from C13 and N15 analyses",2017,"Hydrobiologia","Springer","https://link.springer.com/content/pdf/10.1007/s10750-016-2790-y.pdf","https://scholar.google.com/scholar?cites=11819658576968645431&as_sdt=2005&sciodt=2007&hl=en",14,"2021-11-11 22:23:06","PDF","10.1007/s10750-016-2790-y","","",,,,,22,5.50,6,4,4,"Eutrophication is an increasing global threat to freshwater ecosystems. East Africa's Lake Victoria has suffered from severe eutrophication in the past decades which is partly …","https://link.springer.com/content/pdf/10.1007/s10750-016-2790-y.pdf","https://scholar.google.com/scholar?q=related:N3udPtrcB6QJ:scholar.google.com/&scioq=author:%22mary+kishe%22&hl=en&as_sdt=2007"
17,"MA Kishe-Machumu, JC van Rijssel, JH Wanink…","Differential recovery and spatial distribution pattern of haplochromine cichlids in the Mwanza Gulf of Lake Victoria",2015,"Journal of Great Lakes …","Elsevier","https://www.sciencedirect.com/science/article/pii/S0380133015000519","https://scholar.google.com/scholar?cites=16689183137152167609&as_sdt=2005&sciodt=2007&hl=en",15,"2021-11-11 22:23:06","","","","",,,,,17,2.83,4,4,6,"Lake Victoria had a fish fauna dominated by 500+ species of haplochromines. In the 1980s, the haplochromines from sub-littoral areas of the Mwanza Gulf vanished almost completely …","https://www.eawag.ch/fileadmin/user_upload/tx_userprofiles/upload/vanrijss/Kishe-Machumu_et_al._2015.pdf","https://scholar.google.com/scholar?q=related:ue5k4aPjm-cJ:scholar.google.com/&scioq=author:%22mary+kishe%22&hl=en&as_sdt=2007"
13,"JC van Rijssel, RE Hecky, MA Kishe-Machumu…","Climatic variability in combination with eutrophication drives adaptive responses in the gills of Lake Victoria cichlids",2016,"Oecologia","Springer","https://link.springer.com/article/10.1007/s00442-016-3721-3","https://scholar.google.com/scholar?cites=8525860303824851372&as_sdt=2005&sciodt=2007&hl=en",16,"2021-11-11 22:23:06","","10.1007/s00442-016-3721-3","","",,,,,13,2.60,3,4,5,"Textbook examples of adaptive radiation often show rapid morphological changes in response to environmental perturbations. East Africa's Lake Victoria, famous for its stunning …","https://www.researchgate.net/profile/Jacco-Van-Rijssel/publication/308118108_Climatic_variability_in_combination_with_eutrophication_drives_adaptive_responses_in_the_gills_of_Lake_Victoria_cichlids/links/5a3a188f0f7e9baa5018ab6c/Climatic-variability-in-combination-with-eutrophication-drives-adaptive-responses-in-the-gills-of-Lake-Victoria-cichlids.pdf","https://scholar.google.com/scholar?q=related:rJEVPsbwUXYJ:scholar.google.com/&scioq=author:%22mary+kishe%22&hl=en&as_sdt=2007"
14,"MA Kishe-Machumu","Inter-guild differences and possible causes to the recovery of cichlid species in Lake Victoria, Tanzania.",2012,"","scholarlypublications …","https://scholarlypublications.universiteitleiden.nl/handle/1887/19854","https://scholar.google.com/scholar?cites=12894035873473161524&as_sdt=2005&sciodt=2007&hl=en",17,"2021-11-11 22:23:06","BOOK","","","",,,,,14,1.56,14,1,9,"Until the 1970s, the fish fauna of Lake Victoria was dominated by 500+ endemic haplochromine cichlid species in which detritivores was the dominant group followed by …","https://scholarlypublications.universiteitleiden.nl/access/item%3A2936876/view","https://scholar.google.com/scholar?q=related:NOmCt0_R8LIJ:scholar.google.com/&scioq=author:%22mary+kishe%22&hl=en&as_sdt=2007"
0,"AP Shoko, IA Kimirei, BC Sekadende…","Online course in conjunction with face-to-face workshops to improve writing skills leading towards more publications in peer reviewed journals",2021,"European Science …","ese.arphahub.com","https://ese.arphahub.com/article/54417/download/pdf/","",18,"2021-11-11 22:23:06","PDF","","","",,,,,0,0.00,0,4,1,"Background: Researchers in the developing countries often have inadequate scientific writing skills to publish their research in international peer reviewed journals. Objectives: To …","https://ese.arphahub.com/article/54417/download/pdf/","https://scholar.google.com/scholar?q=related:XGpgt_JkOtUJ:scholar.google.com/&scioq=author:%22mary+kishe%22&hl=en&as_sdt=2007"
8,"M Kalacska, JP Arroyo-Mora, O Lucanus…","Land cover, land use, and climate change impacts on endemic cichlid habitats in northern Tanzania",2017,"Remote Sensing","mdpi.com","https://www.mdpi.com/203658","https://scholar.google.com/scholar?cites=5185325621750386479&as_sdt=2005&sciodt=2007&hl=en",19,"2021-11-11 22:23:06","","","","",,,,,8,2.00,2,4,4,"Freshwater ecosystems are among the most threatened on Earth, facing environmental and anthropogenic pressures often surpassing their terrestrial counterparts. Land use and land …","https://www.mdpi.com/2072-4292/9/6/623/pdf","https://scholar.google.com/scholar?q=related:L88pES769UcJ:scholar.google.com/&scioq=author:%22mary+kishe%22&hl=en&as_sdt=2007"
7,"MA Kishe-Machumu, T Voogd, JH Wanink…","Can differential resurgence of haplochromine trophic groups in Lake Victoria be explained by selective Nile perch, Lates niloticus (L.) predation?",2015,"Environmental Biology of …","Springer","https://link.springer.com/article/10.1007/s10641-014-0356-2","https://scholar.google.com/scholar?cites=3260018826693786353&as_sdt=2005&sciodt=2007&hl=en",20,"2021-11-11 22:23:06","","10.1007/s10641-014-0356-2","","",,,,,7,1.17,2,4,6,"Abstract The introduced Nile perch, Lates niloticus Linnaeus 1758 in Lake Victoria is considered to be a major contributor to the decline of haplochromine species. In the 1990s …","","https://scholar.google.com/scholar?q=related:8TorvtnpPS0J:scholar.google.com/&scioq=author:%22mary+kishe%22&hl=en&as_sdt=2007"
0,"MO Silas, MA Kishe, JG Mshana, ML Semba…","Growth, mortality, exploitation rate and recruitment pattern of Octopus cyanea (Mollusca: Cephalopoda) in the WIO region: A case study from the Mafia Archipelago …",2021,"Western Indian Ocean …","ajol.info","https://www.ajol.info/index.php/wiojms/article/view/198108","",21,"2021-11-11 22:23:06","","","","",,,,,0,0.00,0,5,1,"Octopus cyanea is a commercially important cephalopod in the Western Indian Ocean (WIO) region, but scientific information to inform management strategies for the species is limited. A …","https://www.ajol.info/index.php/wiojms/article/view/198108/199249",""
6,"F Witte, MA Kishe-Machumu, OC Mkumbo…","The fish fauna of Lake Victoria during a century of human induced perturbations",2013,"Proc. Fourth Int. Conf …","eawag.ch","https://www.eawag.ch/fileadmin/user_upload/tx_userprofiles/upload/vanrijss/Witte_et_al._2013.pdf","https://scholar.google.com/scholar?cites=11085780221865507613&as_sdt=2005&sciodt=2007&hl=en",22,"2021-11-11 22:23:06","PDF","","","",,,,,6,0.75,2,4,8,"ABSTRACT WITTE, F., KISHE-MACHUMU, MA, MKUMBO, OC, WANINK, JH, GOUDSWAARD, PC, VAN RIJSSEL, JC & VAN OIJEN, MJP The fish fauna of Lake Victoria …","https://www.eawag.ch/fileadmin/user_upload/tx_userprofiles/upload/vanrijss/Witte_et_al._2013.pdf","https://scholar.google.com/scholar?q=related:HTtYdmCa2JkJ:scholar.google.com/&scioq=author:%22mary+kishe%22&hl=en&as_sdt=2007"
2,"MA Kishe","Aspects of heavy metal pollution in Mwanza Gulf of Lake Victoria, Tanzania",2001,"","University of Dar es Salaam","","https://scholar.google.com/scholar?cites=11925829263136196375&as_sdt=2005&sciodt=2007&hl=en",23,"2021-11-11 22:23:06","CITATION","","","",,,,,2,0.10,2,1,20,"","","https://scholar.google.com/scholar?q=related:FwcxcYcOgaUJ:scholar.google.com/&scioq=author:%22mary+kishe%22&hl=en&as_sdt=2007"
0,"HA Lamtane, EE Ulotu, B Sekadende…","The role of fish-poultry integration on fish growth performance, yields and economic benefits among smallholder farmers.",2019,"","196.44.162.10","http://196.44.162.10:8080/xmlui/handle/20.500.11810/5244","",24,"2021-11-11 22:23:06","","","","",,,,,0,0.00,0,4,2,"Aquaculture practices from sub-Saharan Africa are characterised by low production, owing to improper technology. Production can be increased through integrating fish farming with …","http://196.44.162.10:8080/xmlui/bitstream/handle/20.500.11810/5244/The%20role%20of%20fish-poultry%20integration%20on%20fish%20growth%20.pdf?sequence=1&isAllowed=y","https://scholar.google.com/scholar?q=related:bG1yaNn2pBwJ:scholar.google.com/&scioq=author:%22mary+kishe%22&hl=en&as_sdt=2007"
0,"AP Shoko, SM Limbu, HA Lamtane…","The role of fish-poultry integration on fish growth performance, yields and economic benefits among smallholder farmers.",,"repository.costech.or.tz","","http://repository.costech.or.tz/handle/20.500.11810/5244","",25,"2021-11-11 22:23:06","","","","",,,,,0,0.00,0,4,,"Aquaculture practices from sub-Saharan Africa are characterised by low production, owing to improper technology. Production can be increased through integrating fish farming with …","",""
0,"MA Kishe-Machumu","Inter-guild differences and possible causes of the recovery of cichlid species in",2012,"","scholarlypublications …","https://scholarlypublications.universiteitleiden.nl/access/item%3A2936879/view","",26,"2021-11-11 22:23:06","PDF","","","",,,,,0,0.00,0,1,9,"Lake Victoria's fauna comprised a large endemic flock of more than 500 haplochromine cichlid species that made up more than 80% of the demersal ichthyomass. After the Nile …","https://scholarlypublications.universiteitleiden.nl/access/item%3A2936879/view",""
0,"MA Kishe-Machumu, T Voogd…","Can differential resurgence of haplochromine trophic groups be explained by selective Nile perch predation?",2012,"… causes of the …","scholarlypublications …","https://scholarlypublications.universiteitleiden.nl/access/item%3A2936876/download#page=130","",27,"2021-11-11 22:23:06","PDF","","","",,,,,0,0.00,0,3,9,"The introduced Nile perch in Lake Victoria is considered to have been a major contributor to the decline in species and trophic diversity of haplochromines in Lake Victoria. In the second …","https://scholarlypublications.universiteitleiden.nl/access/item%3A2936876/download#page=130","https://scholar.google.com/scholar?q=related:pX7eTTX9uLYJ:scholar.google.com/&scioq=author:%22mary+kishe%22&hl=en&as_sdt=2007"
0,"JC van Rijssel, RE Hecky, MA Kishe-Machumu…","Climatic variability drives adaptive responses in the gills of Lake Victoria cichlids",,"Adaptive responses to …","core.ac.uk","https://core.ac.uk/download/pdf/19765024.pdf#page=81","",28,"2021-11-11 22:23:06","PDF","","","",,,,,0,0.00,0,4,,"Climate changes and global warming have severe consequences for aquatic ecosystems. In East Africa's Great Lakes, environmental perturbations are occurring as a result of global …","https://core.ac.uk/download/pdf/19765024.pdf#page=81","https://scholar.google.com/scholar?q=related:7X0QkncCiQoJ:scholar.google.com/&scioq=author:%22mary+kishe%22&hl=en&as_sdt=2007"
0,"MA Kishe-Machumu","Inter-guild differences and possible causes of the recovery of cichlid species in Lake Victoria, Tanzania Date: 2012-09-26",2012,"","scholarlypublications …","https://scholarlypublications.universiteitleiden.nl/access/item%3A2936886/download","",29,"2021-11-11 22:23:06","PDF","","","",,,,,0,0.00,0,1,9,"Katunzi EFB & Kishe MA (2004) Changes in population structures of the major fish species in selected satellite lakes around Lake Victoria following changes in fishing effort. Tanzania …","https://scholarlypublications.universiteitleiden.nl/access/item%3A2936886/download","https://scholar.google.com/scholar?q=related:KTqGxyErprAJ:scholar.google.com/&scioq=author:%22mary+kishe%22&hl=en&as_sdt=2007"
0,"JC van Rijssel, ES Hoogwater…","Fast adaptive responses under natural conditions in the premaxilla of Lake Victoria cichlids",,"… changes in Lake …","scholarlypublications …","https://scholarlypublications.universiteitleiden.nl/access/item%3A2920260/download","",30,"2021-11-11 22:23:06","PDF","","","",,,,,0,0.00,0,3,,"Rapid morphological changes in response to fluctuating natural environments are a common phenomenon in species that show adaptive radiation. Most of these changes are …","https://scholarlypublications.universiteitleiden.nl/access/item%3A2920260/download",""
