Cites,Authors,Title,Year,Source,Publisher,ArticleURL,CitesURL,GSRank,QueryDate,Type,DOI,ISSN,CitationURL,Volume,Issue,StartPage,EndPage,ECC,CitesPerYear,CitesPerAuthor,AuthorCount,Age,Abstract,FullTextURL,RelatedURL
0,"R Kayanda, SB Mahongo","Draft Bibliography of Lake Victoria & associated freshwater systems",2002,"","Lake Victoria Environmental …","","",35,"2021-11-12 06:51:45","CITATION","","","",,,,,0,0.00,0,2,19,"","https://core.ac.uk/download/pdf/333871019.pdf","https://scholar.google.com/scholar?q=related:8tAdlzWJnc4J:scholar.google.com/&scioq=author:%22mahongo+sb%22&hl=en&as_sdt=2007"
0,"POJ Bwathondi, AI Chande, CG Mahika, HA Mhitu…","The potential of Sinda Islands for ecotourism and recreation development",2001,"2 nd Western Indian Ocean …","","","",36,"2021-11-12 06:51:45","CITATION","","","",,,,,0,0.00,0,5,20,"","",""
0,"SB Mahongo","Sea Level Measurement And Analysis In The Western Indian Ocean: National Report. Tanzania",1999,"","aquadocs.org","https://aquadocs.org/handle/1834/353","",37,"2021-11-12 06:51:45","","","","",,,,,0,0.00,0,1,22,"During the fourth session of the Intergovernmental Oceanographic Commission's Regional Committee for the Co-operative Investigations in the North and Central Western Indian …","https://aquadocs.org/bitstream/handle/1834/353/Tanzania-SL.pdf?sequence=1&isAllowed=y",""
3,"SB Mahongo","Turbulent heat energy exchange in a Tropical Bay.",1999,"","Tanzania Journal of Science","","https://scholar.google.com/scholar?cites=11725354927909173208&as_sdt=2005&sciodt=2007&hl=en",38,"2021-11-12 06:51:45","CITATION","","","",,,,,3,0.14,3,1,22,"","","https://scholar.google.com/scholar?q=related:2Pdm7y7UuKIJ:scholar.google.com/&scioq=author:%22mahongo+sb%22&hl=en&as_sdt=2007"
3,"SB Mahongo","Sea level measurement and analysis in the Western Indian Ocean. National Report, Tanzania Fisheries Research Institute, Tanzania",1999,"Intergovernmental Oceanographic Commission (of …","","","https://scholar.google.com/scholar?cites=14173896071096585879&as_sdt=2005&sciodt=2007&hl=en",39,"2021-11-12 06:51:45","CITATION","","","",,,,,3,0.14,3,1,22,"","","https://scholar.google.com/scholar?q=related:l04EUWHLs8QJ:scholar.google.com/&scioq=author:%22mahongo+sb%22&hl=en&as_sdt=2007"
3,"SB Mahongo","Sea surface heat exchange and bottom reflection in a tidal, shallow tropical lagoon: Chwaka Bay, Zanzibar",1997,"","Univ.","","https://scholar.google.com/scholar?cites=7294432999541538637&as_sdt=2005&sciodt=2007&hl=en",40,"2021-11-12 06:51:45","CITATION","","","",,,,,3,0.13,3,1,24,"","","https://scholar.google.com/scholar?q=related:TX-PXyoIO2UJ:scholar.google.com/&scioq=author:%22mahongo+sb%22&hl=en&as_sdt=2007"
2,"SB Mahongo","The coastal profile of Mafia Island, Tanzania",1994,"… National Environmental Management Council. Dar es …","","","https://scholar.google.com/scholar?cites=7292555733745610&as_sdt=2005&sciodt=2007&hl=en",41,"2021-11-12 06:51:45","CITATION","","","",,,,,2,0.07,2,1,27,"","","https://scholar.google.com/scholar?q=related:yr8DcoroGQAJ:scholar.google.com/&scioq=author:%22mahongo+sb%22&hl=en&as_sdt=2007"
2,"YW Shaghude, KO Wannäs, SB Mahongo","Hydrodynamic setting of the tidal dominated platforms and reef environment sediments of the Zanzibar channel",2001,"… during the second Western Indian Ocean …","","","https://scholar.google.com/scholar?cites=17650739169040577842&as_sdt=2005&sciodt=2007&hl=en",42,"2021-11-12 06:51:45","CITATION","","","",,,,,2,0.10,1,3,20,"","","https://scholar.google.com/scholar?q=related:MrW8scEF9PQJ:scholar.google.com/&scioq=author:%22mahongo+sb%22&hl=en&as_sdt=2007"
2,"SB Mahongo","Bottom reflection in a shallow tidal bay",1998,"Tanzania Journal of Science","","","https://scholar.google.com/scholar?cites=2828341452694514292&as_sdt=2005&sciodt=2007&hl=en",43,"2021-11-12 06:51:45","CITATION","","","",,,,,2,0.09,2,1,23,"","","https://scholar.google.com/scholar?q=related:dGpe55BJQCcJ:scholar.google.com/&scioq=author:%22mahongo+sb%22&hl=en&as_sdt=2007"
0,"J Francis, SB Mahongo, A Semesi, CA Muhando…","Coastal resources and their use. In: Eastern Africa Atlas of Coastal Resources",,"repository.costech.or.tz","","http://repository.costech.or.tz/handle/123456789/2293","",44,"2021-11-12 06:51:45","CITATION","","","",,,,,0,0.00,0,5,,"Coastal resources and their use. In: Eastern Africa Atlas of Coastal Resources COSTECH Integrated Repository Coastal resources and their use. In: Eastern Africa Atlas of Coastal …","",""
0,"B Kuguru, SB Mahongo, I Sailale…","Application of Remote Sensing in Predicting Suitable Fishing Areas for Pelagic Fish in the Continental Shelf of Tanzania",2019,"2019 Joint Satellite …","ams.confex.com","https://ams.confex.com/ams/JOINTSATMET/meetingapp.cgi/Paper/361421","",45,"2021-11-12 06:51:45","CITATION","","","",,,,,0,0.00,0,4,2,"","",""
0,"A Semesi, CA Muhando, SB Mahongo, J Daffa…","Coastal resources and their use. In: Eastern Africa Atlas of Coastal Resources",2001,"","196.44.162.10","http://196.44.162.10:8080/xmlui/handle/123456789/535","",46,"2021-11-12 06:51:45","CITATION","","","",,,,,0,0.00,0,5,20,"Coastal resources and their use. In: Eastern Africa Atlas of Coastal Resources University of Dar es Salaam Research Repository Coastal resources and their use. In: Eastern Africa Atlas of …","",""
0,"SB Mahongo, CA Muhando, J Daffa, M Ngoile…","Eastern Africa Atlas of Coastal Resources: Tanzania",2001,"","196.44.162.10","http://196.44.162.10:8080/xmlui/handle/20.500.11810/3779","",47,"2021-11-12 06:51:45","CITATION","","","",,,,,0,0.00,0,5,20,"Eastern Africa Atlas of Coastal Resources: Tanzania University of Dar es Salaam Research Repository Eastern Africa Atlas of Coastal Resources: Tanzania Login Home → College of …","",""
