Cites,Authors,Title,Year,Source,Publisher,ArticleURL,CitesURL,GSRank,QueryDate,Type,DOI,ISSN,CitationURL,Volume,Issue,StartPage,EndPage,ECC,CitesPerYear,CitesPerAuthor,AuthorCount,Age,Abstract,FullTextURL,RelatedURL
42,"SB Mahongo, J Francis, SE Osima","Wind patterns of coastal Tanzania: their variability and trends",2011,"Western Indian Ocean Journal of …","ajol.info","https://www.ajol.info/index.php/wiojms/article/view/85853","https://scholar.google.com/scholar?cites=3967414316949369160&as_sdt=2005&sciodt=2007&hl=en",1,"2021-11-12 06:51:45","","","","",,,,,42,4.20,14,3,10,"1Tanzania Fisheries Research Institute, PO Box 9750, Dar es Salaam, Tanzania; 2Department of Aquatic Sciences and Fisheries, University of Dar es Salaam, PO Box …","https://www.ajol.info/index.php/wiojms/article/view/85853/75729","https://scholar.google.com/scholar?q=related:SPGQDk0WDzcJ:scholar.google.com/&scioq=author:%22mahongo+sb%22&hl=en&as_sdt=2007"
31,"SB Mahongo, YW Shaghude","Modelling the dynamics of the Tanzanian coastal waters",2014,"Journal of Oceanography and …","academicjournals.org","https://academicjournals.org/journal/JOMS/article-abstract/B8F85F242619","https://scholar.google.com/scholar?cites=2684055577294252317&as_sdt=2005&sciodt=2007&hl=en",2,"2021-11-12 06:51:45","","","","",,,,,31,4.43,16,2,7,"A numerical modeling study was carried out using the Regional Ocean Modeling System (ROMS) for the Tanzanian coast to investigate the seasonal dynamics of water circulation …","https://academicjournals.org/journal/JOMS/article-full-text-pdf/B8F85F242619.pdf","https://scholar.google.com/scholar?q=related:HakHqlOuPyUJ:scholar.google.com/&scioq=author:%22mahongo+sb%22&hl=en&as_sdt=2007"
31,"YW Shaghude, KO Wannas, SB Mahongo","Biogenic assemblage and hydrodynamic settings of the tidally dominated reef platform sediments of the Zanzibar Channel",2002,"","aquadocs.org","https://aquadocs.org/handle/1834/32","https://scholar.google.com/scholar?cites=1068761860631022614&as_sdt=2005&sciodt=2007&hl=en",3,"2021-11-12 06:51:45","","","","",,,,,31,1.63,10,3,19,"The biogenic assemblage and hydrodynamic settings of the tidally dominated reef platform sediments (TDRPS) east of the Zanzibar channel were investigated in order to characterise …","https://aquadocs.org/bitstream/handle/1834/32/WIOJ12107.pdf?sequence=1&isAllowed=y","https://scholar.google.com/scholar?q=related:Fsxl7D8B1Q4J:scholar.google.com/&scioq=author:%22mahongo+sb%22&hl=en&as_sdt=2007"
18,"SB Mahongo, MC Deo","Using artificial neural networks to forecast monthly and seasonal sea surface temperature anomalies in the western Indian Ocean",2013,"The International Journal of Ocean …","journals.sagepub.com","https://journals.sagepub.com/doi/abs/10.1260/1759-3131.4.2.133","https://scholar.google.com/scholar?cites=2471062791111977175&as_sdt=2005&sciodt=2007&hl=en",4,"2021-11-12 06:51:45","","10.1260/1759-3131.4.2.133","","",,,,,18,2.25,9,2,8,"A study implementing Nonlinear Autoregressive with Exogenous Input (NARX) neural network has been undertaken to predict monthly and seasonal SST anomalies in the …","https://journals.sagepub.com/doi/pdf/10.1260/1759-3131.4.2.133","https://scholar.google.com/scholar?q=related:1yjqKYT6SiIJ:scholar.google.com/&scioq=author:%22mahongo+sb%22&hl=en&as_sdt=2007"
15,"J Francis, SB Mahongo","Analysis of rainfall variations and trends in coastal Tanzania",2012,"Western Indian Ocean Journal of Marine Science","ajol.info","https://www.ajol.info/index.php/wiojms/article/view/78644","https://scholar.google.com/scholar?cites=363143717540622727&as_sdt=2005&sciodt=2007&hl=en",5,"2021-11-12 06:51:45","","","","",,,,,15,1.67,8,2,9,"Rainfall in coastal Tanzania has been investigated for their variability and trends from seven key weather stations during the last 50 years (1960-2009). Results indicate that the island of …","https://www.ajol.info/index.php/wiojms/article/download/78644/86976","https://scholar.google.com/scholar?q=related:h3FsfkklCgUJ:scholar.google.com/&scioq=author:%22mahongo+sb%22&hl=en&as_sdt=2007"
11,"SB Mahongo, J Francis","Monthly variations in sea level at the island of Zanzibar",2010,"Western Indian Ocean Journal of Marine Science","ajol.info","https://www.ajol.info/index.php/wiojms/article/view/73963","https://scholar.google.com/scholar?cites=11350306979916045815&as_sdt=2005&sciodt=2007&hl=en",6,"2021-11-12 06:51:45","","","","",,,,,11,1.00,6,2,11,"Meteorological and tide gauge data were used to analyze correlations between climatic parameters and variations in mean sea level at Zanzibar for the period 1985-2004. This …","https://www.ajol.info/index.php/wiojms/article/download/73963/64635","https://scholar.google.com/scholar?q=related:912IzQ9khJ0J:scholar.google.com/&scioq=author:%22mahongo+sb%22&hl=en&as_sdt=2007"
14,"SB Mahongo","The changing global climate and its implication on sea level trends in Tanzania and the Western Indian Ocean Region",2009,"Western Indian Ocean Journal of Marine Science","ajol.info","https://www.ajol.info/index.php/wiojms/article/view/56971","https://scholar.google.com/scholar?cites=15038680243706374593&as_sdt=2005&sciodt=2007&hl=en",7,"2021-11-12 06:51:45","","","","",,,,,14,1.17,14,1,12,"Global mean sea levels show a general rising trend that has been accelerated by the recent changes in world climate. This is ascertained through geological and historical records …","https://www.ajol.info/index.php/wiojms/article/view/56971/45368","https://scholar.google.com/scholar?q=related:wanN2AAgtNAJ:scholar.google.com/&scioq=author:%22mahongo+sb%22&hl=en&as_sdt=2007"
2,"JS Sululu, AT Kamukuru, BC Sekadende…","Reproductive biology of the anchovy (Stolephorus commersonnii, Lacepède, 1803) and spotted sardine (Amblygaster sirm, Walbaum, 1792) from Tanga Region …",2020,"Western Indian Ocean …","ajol.info","https://www.ajol.info/index.php/wiojms/article/view/174218","https://scholar.google.com/scholar?cites=8623631399225137066&as_sdt=2005&sciodt=2007&hl=en",8,"2021-11-12 06:51:45","","","","",,,,,2,2.00,1,4,1,"The present study investigated the reproductive biology of Stolephorus commersonnii and Amblygaster sirm at two landing sites in Tanga on the northern coast of Tanzania. Fish …","https://www.ajol.info/index.php/wiojms/article/download/174218/192287","https://scholar.google.com/scholar?q=related:qhe4UBFLrXcJ:scholar.google.com/&scioq=author:%22mahongo+sb%22&hl=en&as_sdt=2007"
6,"SB Mahongo, OI Khamis","The Tanzania National Sea Level Report",2006,"… Institute and Department of Survey and …","researchgate.net","https://www.researchgate.net/profile/Shigalla-Mahongo/publication/268422243_THE_TANZANIAN_NATIONAL_SEA_LEVEL_REPORT/links/54bdce120cf27c8f2814cd1f/THE-TANZANIAN-NATIONAL-SEA-LEVEL-REPORT.pdf","https://scholar.google.com/scholar?cites=5451459999324522166&as_sdt=2005&sciodt=2007&hl=en",9,"2021-11-12 06:51:45","PDF","","","",,,,,6,0.40,3,2,15,"This report has been prepared for the IOC/GLOSS Training Workshop on Sea Level Measurement, Interpretation and Related Fields held in Tokyo (Japan) from 15-26 May 2006 …","https://www.researchgate.net/profile/Shigalla-Mahongo/publication/268422243_THE_TANZANIAN_NATIONAL_SEA_LEVEL_REPORT/links/54bdce120cf27c8f2814cd1f/THE-TANZANIAN-NATIONAL-SEA-LEVEL-REPORT.pdf","https://scholar.google.com/scholar?q=related:tkb9fvx5p0sJ:scholar.google.com/&scioq=author:%22mahongo+sb%22&hl=en&as_sdt=2007"
1,"I Halo, P Sagero, M Manyilizu, SB Mahongo","Biophysical modelling of coastal upwelling variability and circulation along the Tanzanian and Kenyan coasts",2020,"Western Indian Ocean …","ajol.info","https://www.ajol.info/index.php/wiojms/article/view/181566","https://scholar.google.com/scholar?cites=14490222735931833369&as_sdt=2005&sciodt=2007&hl=en",10,"2021-11-12 06:51:45","","","","",,,,,1,1.00,0,4,1,"Ocean circulation, upwelling phenomena and chlorophyll-a concentrations were investigated within the framework of numerical model simulations with 1/12 nested …","https://www.ajol.info/index.php/wiojms/article/download/181566/192284","https://scholar.google.com/scholar?q=related:GXyBS86cF8kJ:scholar.google.com/&scioq=author:%22mahongo+sb%22&hl=en&as_sdt=2007"
2,"IA Kimirei, M Semba, C Mwakosya, YD Mgaya…","Environmental Changes in the Tanzanian Part of Lake Victoria",2017,"Lake Victoria Fisheries …","Springer","https://link.springer.com/chapter/10.1007/978-3-319-69656-0_3","https://scholar.google.com/scholar?cites=14609593990559801209&as_sdt=2005&sciodt=2007&hl=en",11,"2021-11-12 06:51:45","","10.1007/978-3-319-69656-0_3","","",,,,,2,0.50,0,5,4,"Lake Victoria is known for its explosive speciation and recent time hybridization, which is highly mediated by deterioration of water quality. This chapter summarizes the knowledge …","http://ndl.ethernet.edu.et/bitstream/123456789/41021/1/206.Yunus%20D.%20Mgaya.pdf#page=47","https://scholar.google.com/scholar?q=related:eZ__V1S0v8oJ:scholar.google.com/&scioq=author:%22mahongo+sb%22&hl=en&as_sdt=2007"
3,"SB Mahongo","Analysis of met-ocean processes in relation to changes in large scale climatic systems in Tanzania and the western Indian Ocean",2014,"","University of Dar es Salaam","","https://scholar.google.com/scholar?cites=3368689549759380089&as_sdt=2005&sciodt=2007&hl=en",12,"2021-11-12 06:51:45","CITATION","","","",,,,,3,0.43,3,1,7,"","","https://scholar.google.com/scholar?q=related:eXr6I0z9vy4J:scholar.google.com/&scioq=author:%22mahongo+sb%22&hl=en&as_sdt=2007"
3,"SB Mahongo","Radiative heat exchange in a tropical Chwaka bay, east coast of Zanzibar",2000,"","nopr.niscair.res.in","http://nopr.niscair.res.in/handle/123456789/25267","https://scholar.google.com/scholar?cites=15619187657605614457&as_sdt=2005&sciodt=2007&hl=en",13,"2021-11-12 06:51:45","","","","",,,,,3,0.14,3,1,21,"Radiative heat fluxes were measured from a platform during the period 18 January through 9 February 1996. Cloud cover ranged from clear skies to overcast while the air temperature …","http://nopr.niscair.res.in/bitstream/123456789/25267/1/IJMS%2029(1)%2012-18.pdf","https://scholar.google.com/scholar?q=related:eYu_q2uAwtgJ:scholar.google.com/&scioq=author:%22mahongo+sb%22&hl=en&as_sdt=2007"
3,"SB Mahongo","The Tanzania Sea Level Network: A National Report (Draft)",2001,"Tanzania Fisheries Research Institute","gloss-sealevel.org","https://www.gloss-sealevel.org/sites/gloss/files/publications/documents/tanzania_2001.pdf","https://scholar.google.com/scholar?cites=11923626726020045889&as_sdt=2005&sciodt=2007&hl=en",14,"2021-11-12 06:51:45","PDF","","","",,,,,3,0.15,3,1,20,"THE TANZANIAN TIDE GAUGE NETWORK Page 1 THE TANZANIAN SEA LEVEL NETWORK: A NATIONAL REPORT (DRAFT) Shigalla B. Mahongo Tanzania Fisheries Research Institute …","https://www.gloss-sealevel.org/sites/gloss/files/publications/documents/tanzania_2001.pdf","https://scholar.google.com/scholar?q=related:QVzHTlU7eaUJ:scholar.google.com/&scioq=author:%22mahongo+sb%22&hl=en&as_sdt=2007"
2,"SB Mahongo","Annual to Inter-Decadal Variability of Surface Air Temperature along the Coast of Tanzania",2014,"Western Indian Ocean Journal of Marine Science","ajol.info","https://www.ajol.info/index.php/wiojms/article/view/78728","https://scholar.google.com/scholar?cites=14183430635159937875&as_sdt=2005&sciodt=2007&hl=en",15,"2021-11-12 06:51:45","","","","",,,,,2,0.29,2,1,7,"The patterns of atmospheric surface temperature along the coast of Tanzania were investigated for variability and decadal trends over the past 50 years (1960-2009). Various …","https://www.ajol.info/index.php/wiojms/article/view/78728/119612","https://scholar.google.com/scholar?q=related:U-MZAQSr1cQJ:scholar.google.com/&scioq=author:%22mahongo+sb%22&hl=en&as_sdt=2007"
4,"YW Shaghude, SB Mahongo, A Muzuka…","Physical and geological processes in Chwaka Bay",2012,"People, Nature and …","researchgate.net","https://www.researchgate.net/profile/Shigalla-Mahongo/publication/256133451_Physical_and_Geological_Processes_in_Chwaka_Bay/links/5c5bfc79a6fdccb608ae0499/Physical-and-Geological-Processes-in-Chwaka-Bay.pdf","https://scholar.google.com/scholar?cites=13016248047004218670&as_sdt=2005&sciodt=2007&hl=en",16,"2021-11-12 06:51:45","PDF","","","",,,,,4,0.44,1,4,9,"Estuaries, lagoons and bays are among the most prominent coastal geomorphological features of the coast of Tanzania. These features are extensively utilized by communities for …","https://www.researchgate.net/profile/Shigalla-Mahongo/publication/256133451_Physical_and_Geological_Processes_in_Chwaka_Bay/links/5c5bfc79a6fdccb608ae0499/Physical-and-Geological-Processes-in-Chwaka-Bay.pdf","https://scholar.google.com/scholar?q=related:LvUOvqIAo7QJ:scholar.google.com/&scioq=author:%22mahongo+sb%22&hl=en&as_sdt=2007"
1,"EFB Katunzi, PO Onyango, SB Mahongo…","Historical Perspectives and Trends in Fisheries Research in Tanzania",2017,"Lake Victoria Fisheries …","Springer","https://link.springer.com/chapter/10.1007/978-3-319-69656-0_2","https://scholar.google.com/scholar?cites=12034061448117630297&as_sdt=2005&sciodt=2007&hl=en",17,"2021-11-12 06:51:45","","10.1007/978-3-319-69656-0_2","","",,,,,1,0.25,0,4,4,"This chapter traces the history and trends in fisheries research for the Tanzanian part of Lake Victoria and its basin back to the late nineteenth century when the haplochromine …","https://ndl.ethernet.edu.et/bitstream/123456789/41021/1/206.Yunus%20D.%20Mgaya.pdf#page=22","https://scholar.google.com/scholar?q=related:WTVGvCCTAacJ:scholar.google.com/&scioq=author:%22mahongo+sb%22&hl=en&as_sdt=2007"
2,"SB Mahongo, YW Shaghude","Investigating the Effect of Winds and Storms on Shoreline Erosion along the Coast of Tanzania",2013,"","196.44.162.10","http://196.44.162.10:8080/xmlui/handle/123456789/474","https://scholar.google.com/scholar?cites=8932410286566444541&as_sdt=2005&sciodt=2007&hl=en",18,"2021-11-12 06:51:45","","","","",,,,,2,0.25,1,2,8,"Wind data spanning 28 years (1977-2004) from four meteorological stations (Tanga, Zanzibar, Dar es Salaam and Mtwara) were analyzed to elucidate the effect of winds on …","http://196.44.162.10:8080/xmlui/bitstream/handle/123456789/474/Mahongo%20and%20Shaghude_2013_investigating_page61-69.pdf?sequence=1&isAllowed=y","https://scholar.google.com/scholar?q=related:_Y3WZtRL9nsJ:scholar.google.com/&scioq=author:%22mahongo+sb%22&hl=en&as_sdt=2007"
2,"YD Mgaya, SB Mahongo","Lake Victoria Fisheries Resources: Research and Management in Tanzania",2017,"","books.google.com","https://books.google.com/books?hl=en&lr=&id=msJADwAAQBAJ&oi=fnd&pg=PR7&dq=%22mahongo+sb%22&ots=zfU_YSG3p2&sig=wUt0t_LamvEUe5PbmxlMy4Aui8M","https://scholar.google.com/scholar?cites=3295805372644615775&as_sdt=2005&sciodt=2007&hl=en",19,"2021-11-12 06:51:45","BOOK","","","",,,,,2,0.50,1,2,4,"This book synthesises the historical trends of the lake fisheries, the lake ecology, biology and biodiversity, socio-economics, stock assessment, aquaculture, fish quality assurance …","http://196.44.162.10:8080/xmlui/bitstream/handle/20.500.11810/5240/Chapter%207-%20Aquaculture%20and%C2%A0Fisheries%20Extension.pdf?sequence=1&isAllowed=y","https://scholar.google.com/scholar?q=related:X2ZORYYNvS0J:scholar.google.com/&scioq=author:%22mahongo+sb%22&hl=en&as_sdt=2007"
0,"J Kamau, O Ochola, B Ohowa, C Mitto, C Magori…","Employing multivariate analysis to determine the drivers of productivity on the North Kenya Bank and in Kenyan territorial waters",2020,"Western Indian Ocean …","ajol.info","https://www.ajol.info/index.php/wiojms/article/view/174257","",20,"2021-11-12 06:51:45","","","","",,,,,0,0.00,0,6,1,"A complex mix of natural processes exist in nearshore and offshore waters which influence coastal and marine ecosystem productivity. An understanding of the biogeochemical …","https://www.ajol.info/index.php/wiojms/article/view/174257/192283","https://scholar.google.com/scholar?q=related:E1c69eNbXlYJ:scholar.google.com/&scioq=author:%22mahongo+sb%22&hl=en&as_sdt=2007"
0,"MS Kyewalyanga, N Peter, M Semba…","Coastal upwelling and seasonal variation in phytoplankton biomass in the Pemba Channel",2020,"Western Indian Ocean …","ajol.info","https://www.ajol.info/index.php/wiojms/article/view/174215","",21,"2021-11-12 06:51:45","","","","",,,,,0,0.00,0,4,1,"This study was conducted in the Pemba Channel off Tanga Region in northern Tanzania to investigate physical and chemical factors that drive changes in phytoplankton biomass …","https://www.ajol.info/index.php/wiojms/article/view/174215/192282","https://scholar.google.com/scholar?q=related:jlEu353td4QJ:scholar.google.com/&scioq=author:%22mahongo+sb%22&hl=en&as_sdt=2007"
0,"BC Sekadende, JS Sululu, AT Kamukuru…","Preliminary findings on the food and feeding dynamics of the anchovy Stolephorus commersonnii (Lacepède, 1803) and the Indian mackerel Rastrelliger kanagurta …",2020,"Western Indian Ocean …","ajol.info","https://www.ajol.info/index.php/wiojms/article/view/175176","",22,"2021-11-12 06:51:45","","","","",,,,,0,0.00,0,4,1,"Small pelagic fishes play an important role in the ecosystem by linking planktonic production and higher trophic level predators, and provide a livelihood to both the small-scale and …","https://www.ajol.info/index.php/wiojms/article/download/175176/192286","https://scholar.google.com/scholar?q=related:v0Nj7eVCSj4J:scholar.google.com/&scioq=author:%22mahongo+sb%22&hl=en&as_sdt=2007"
0,"M García-Reyes, SB Mahongo","Present and future trends in winds and SST off central East Africa",2020,"Western Indian Ocean Journal of Marine …","ajol.info","https://www.ajol.info/index.php/wiojms/article/view/177907","",23,"2021-11-12 06:51:45","","","","",,,,,0,0.00,0,2,1,"The coast of central East Africa (CEA) is a dynamic region in terms of climate, in which fisheries and marine-related services impact a large portion of the population. The main …","https://www.ajol.info/index.php/wiojms/article/view/177907/192285","https://scholar.google.com/scholar?q=related:h5XYT91pi9EJ:scholar.google.com/&scioq=author:%22mahongo+sb%22&hl=en&as_sdt=2007"
1,"R Mwaipopo, SB Mahongo","Adaptive capacity of small pelagic fishing communities in coastal Tanga (Tanzania) to changes in climate-related phenomena",2020,"Western Indian Ocean Journal of Marine …","ajol.info","https://www.ajol.info/index.php/wiojms/article/view/175456","https://scholar.google.com/scholar?cites=4878174169239070011&as_sdt=2005&sciodt=2007&hl=en",24,"2021-11-12 06:51:45","","","","",,,,,1,1.00,1,2,1,"Studies examining the vulnerability, resilience and adaptation options of fisheries-dependent coastal communities have noted a decrease in viable options to respond …","https://www.ajol.info/index.php/wiojms/article/view/175456/192292","https://scholar.google.com/scholar?q=related:OyX7rY_BskMJ:scholar.google.com/&scioq=author:%22mahongo+sb%22&hl=en&as_sdt=2007"
0,"J Ochiewo, F Munyi, E Waiyaki, F Kimanga…","Livelihood impacts and adaptation in fishing practices as a response to recent climatic changes in the upwelling region of the East African Coastal Current",2020,"Western Indian Ocean …","ajol.info","https://www.ajol.info/index.php/wiojms/article/view/174503","",25,"2021-11-12 06:51:45","","","","",,,,,0,0.00,0,5,1,"A socio-economic assessment was carried out at Amu and Shela in Lamu County and Ngomeni in Kilifi County on the coast of Kenya. The aim was to establish fisher perspectives …","https://www.ajol.info/index.php/wiojms/article/view/174503/192290","https://scholar.google.com/scholar?q=related:a1XDcvy394AJ:scholar.google.com/&scioq=author:%22mahongo+sb%22&hl=en&as_sdt=2007"
0,"C Mitto, SB Mahongo, M Osore, O Ochala, J Kamau…","Employing multivariate analysis to determine the drivers of productivity on the North Kenya Bank and in Kenyan territorial waters",2020,"","196.44.162.10","http://196.44.162.10:8080/xmlui/handle/20.500.11810/5563","",26,"2021-11-12 06:51:45","","","","",,,,,0,0.00,0,6,1,"A complex mix of natural processes exist in nearshore and offshore waters which influence coastal and marine ecosystem productivity. An understanding of the biogeochemical …","http://196.44.162.10:8080/xmlui/bitstream/handle/20.500.11810/5563/KAMAU-2_ET%20AL_2020.pdf?sequence=1&isAllowed=y","https://scholar.google.com/scholar?q=related:UnXBv87Q9kwJ:scholar.google.com/&scioq=author:%22mahongo+sb%22&hl=en&as_sdt=2007"
0,"M Manyilizu, P Sagero, I Halo, SB Mahongo","A comparative study of ocean surface interannual variability in Northern Tanzania and the Northern Kenya Bank",2020,"Western Indian Ocean …","ajol.info","https://www.ajol.info/index.php/wiojms/article/view/174266","",27,"2021-11-12 06:51:45","","","","",,,,,0,0.00,0,4,1,"The livelihoods of most residents of Tanga (Northern Tanzania) and Malindi (Northern Kenya), rely strongly on fishing activities in the East African shelf region. Thus …","https://www.ajol.info/index.php/wiojms/article/view/174266/192278","https://scholar.google.com/scholar?q=related:P1BjKJBMhTgJ:scholar.google.com/&scioq=author:%22mahongo+sb%22&hl=en&as_sdt=2007"
1,"J Kamau, N Ngisiange, O Ochola, J Kilionzi…","Factors influencing spatial patterns in primary productivity in Kenyan territorial waters",2020,"Western Indian Ocean …","ajol.info","https://www.ajol.info/index.php/wiojms/article/view/174264","https://scholar.google.com/scholar?cites=5928676319719642774&as_sdt=2005&sciodt=2007&hl=en",28,"2021-11-12 06:51:45","","","","",,,,,1,1.00,0,5,1,"This study was formulated to investigate productivity systems within Kenyan territorial waters. The interaction of processes on the margins of the marine waters, particularly the …","https://www.ajol.info/index.php/wiojms/article/view/174264/192281","https://scholar.google.com/scholar?q=related:ltYoibPjRlIJ:scholar.google.com/&scioq=author:%22mahongo+sb%22&hl=en&as_sdt=2007"
0,"AT Kamukuru, SB Mahongo, BC Sekadende…","Age, growth and mortality of the anchovy Stolephorus commersonnii (Lacepède, 1803)(Clupeiformes) caught off the coast of Tanga, Tanzania",2020,"Western Indian Ocean …","ajol.info","https://www.ajol.info/index.php/wiojms/article/view/174571","",29,"2021-11-12 06:51:45","","","","",,,,,0,0.00,0,4,1,"The population dynamics of Stolephorus commersonnii (Lacepède, 1803) from a ringnet fishery operating off the northern coast of Tanga Region were evaluated based on monthly …","https://www.ajol.info/index.php/wiojms/article/download/174571/192289","https://scholar.google.com/scholar?q=related:5-DwepHh3jEJ:scholar.google.com/&scioq=author:%22mahongo+sb%22&hl=en&as_sdt=2007"
0,"EJ Mosha, SB Mahongo, RB Hoza…","Financing Mechanisms for Lake Victoria Fisheries Management",2017,"Lake Victoria Fisheries …","Springer","https://link.springer.com/chapter/10.1007/978-3-319-69656-0_10","",30,"2021-11-12 06:51:45","","10.1007/978-3-319-69656-0_10","","",,,,,0,0.00,0,4,4,"Management of fisheries in the Lake Victoria Basin is faced with a multitude of natural and anthropogenic pressures such as over-fishing, eutrophication, declining water levels, soil …","http://ndl.ethernet.edu.et/bitstream/123456789/41021/1/206.Yunus%20D.%20Mgaya.pdf#page=212","https://scholar.google.com/scholar?q=related:sEjj8Att-tQJ:scholar.google.com/&scioq=author:%22mahongo+sb%22&hl=en&as_sdt=2007"
12,"IK Nhnyete, SB Mahongo","National report of the United Republic of Tanzania on sea level measurements",2007,"Tanzania Ports Authority and Tanzania Fisheries …","","","https://scholar.google.com/scholar?cites=5178415443175814574&as_sdt=2005&sciodt=2007&hl=en",31,"2021-11-12 06:51:45","CITATION","","","",,,,,12,0.86,6,2,14,"","","https://scholar.google.com/scholar?q=related:rjXkvWht3UcJ:scholar.google.com/&scioq=author:%22mahongo+sb%22&hl=en&as_sdt=2007"
0,"YD Mgaya, SB Mahongo","Lake Victoria Fisheries Resources",,"Springer","","https://link.springer.com/content/pdf/10.1007/978-3-319-69656-0.pdf","",32,"2021-11-12 06:51:45","","10.1007/978-3-319-69656-0","","",,,,,0,0.00,0,2,,"This book has benefitted from the implementation of Phase I of the Lake Victoria Environmental Management Project–LVEMP I (1997–2005), complemented by previous …","http://ndl.ethernet.edu.et/bitstream/123456789/41021/1/206.Yunus%20D.%20Mgaya.pdf","https://scholar.google.com/scholar?q=related:R5GahkCimyMJ:scholar.google.com/&scioq=author:%22mahongo+sb%22&hl=en&as_sdt=2007"
6,"J Francis, SB Mahongo, AK Semesi, CA Muhando…","Eastern Africa Atlas of Coastal Resources: Tanzania",2001,"","repository.costech.or.tz","http://repository.costech.or.tz/handle/20.500.11810/3779","https://scholar.google.com/scholar?cites=16200205945557254246&as_sdt=2005&sciodt=2007&hl=en",33,"2021-11-12 06:51:45","CITATION","","","",,,,,6,0.30,1,5,20,"Eastern Africa Atlas of Coastal Resources: Tanzania COSTECH Integrated Repository Eastern Africa Atlas of Coastal Resources: Tanzania Login COSTECH Repository Home → University …","","https://scholar.google.com/scholar?q=related:ZoAcoXmx0uAJ:scholar.google.com/&scioq=author:%22mahongo+sb%22&hl=en&as_sdt=2007"
1,"J Katondo, PK Chisara, SB Mahongo","The diversity of aquatic birds and their relationship to aquatic ecosystems in the Lake Victoria basin",2005,"","repository.eac.int","http://repository.eac.int/handle/11671/812","https://scholar.google.com/scholar?cites=3471557809301742719&as_sdt=2005&sciodt=2007&hl=en",34,"2021-11-12 06:51:45","","","","",,,,,1,0.06,0,3,16,"Lake Victoria basin harbours a variety of aquatic ecosystems mainly referred to as wetlands. These wetlands range from permanent swamps, open water bodies and river systems. The …","http://repository.eac.int/bitstream/handle/11671/812/The%20diversity%20of%20aquatic%20birds%20and%20their%20relationship%20to%20aquatic%20ecosystems%20in%20the%20Lake%20Victoria%20basin.pdf?sequence=1",""
