Cites,Authors,Title,Year,Source,Publisher,ArticleURL,CitesURL,GSRank,QueryDate,Type,DOI,ISSN,CitationURL,Volume,Issue,StartPage,EndPage,ECC,CitesPerYear,CitesPerAuthor,AuthorCount,Age,Abstract,FullTextURL,RelatedURL
12,"MO Silas, SS Mgeleka, P Polte, M Sköld…","Adaptive capacity and coping strategies of small-scale coastal fisheries to declining fish catches: Insights from Tanzanian communities",2020,"… Science & Policy","Elsevier","https://www.sciencedirect.com/science/article/pii/S1462901119309116","https://scholar.google.com/scholar?cites=16143177442349175911&as_sdt=2005&sciodt=2007&hl=en",1,"2021-11-11 22:25:51","","","","",,,,,12,12.00,2,5,1,"Small-scale fishing communities are expected to adapt to fish catch fluctuations linked to global environmental change. Notwithstanding, impacts from severe climate events and …","","https://scholar.google.com/scholar?q=related:Z1RShVoWCOAJ:scholar.google.com/&scioq=author:%22silas+mathew%22&hl=en&as_sdt=2007"
11,"M Jahnke, M Gullström, J Larsson…","Population genetic structure and connectivity of the seagrass Thalassia hemprichii in the Western Indian Ocean is influenced by predominant ocean currents",2019,"Ecology and …","Wiley Online Library","https://onlinelibrary.wiley.com/doi/abs/10.1002/ece3.5420","https://scholar.google.com/scholar?cites=7506516603862584795&as_sdt=2005&sciodt=2007&hl=en",2,"2021-11-11 22:25:51","","10.1002/ece3.5420","","",,,,,11,5.50,3,4,2,"This study is the first large‐scale genetic population study of a widespread climax species of seagrass, Thalassia hemprichii, in the Western Indian Ocean (WIO). The aim was to …","https://onlinelibrary.wiley.com/doi/pdfdirect/10.1002/ece3.5420","https://scholar.google.com/scholar?q=related:2w3NeRSBLGgJ:scholar.google.com/&scioq=author:%22silas+mathew%22&hl=en&as_sdt=2007"
0,"RJ Wilson, SF Sailley, ZL Jacobs, J Kamau…","Large projected reductions in marine fish biomass for Kenya and Tanzania in the absence of climate mitigation",2021,"Ocean & Coastal …","Elsevier","https://www.sciencedirect.com/science/article/pii/S096456912100404X","",3,"2021-11-11 22:25:51","HTML","","","",,,,,0,0.00,0,5,1,"Climate change is projected to cause significant reductions in global fisheries catch during the 21st Century. Yet, little is understood of climate change impacts on tropical fisheries …","https://www.sciencedirect.com/science/article/pii/S096456912100404X",""
5,"MO Silas","Review of the Tanzanian prawn Fishery",2011,"","bora.uib.no","https://bora.uib.no/bora-xmlui/handle/1956/5584","https://scholar.google.com/scholar?cites=4654510435329530653&as_sdt=2005&sciodt=2007&hl=en",4,"2021-11-11 22:25:51","","","","",,,,,5,0.50,5,1,10,"A review of the prawn fishery of Tanzania from its development in early 1980's to closure in 2008 has been performed based on three major data sets; industrial prawn and fish catch …","https://bora.uib.no/bora-xmlui/bitstream/handle/1956/5584/84856931.pdf?sequence=1","https://scholar.google.com/scholar?q=related:HVsqjZQkmEAJ:scholar.google.com/&scioq=author:%22silas+mathew%22&hl=en&as_sdt=2007"
0,"MO Silas, MA Kishe, JG Mshana, ML Semba…","Growth, mortality, exploitation rate and recruitment pattern of Octopus cyanea (Mollusca: Cephalopoda) in the WIO region: A case study from the Mafia Archipelago …",2021,"Western Indian Ocean …","ajol.info","https://www.ajol.info/index.php/wiojms/article/view/198108","",5,"2021-11-11 22:25:51","","","","",,,,,0,0.00,0,5,1,"Octopus cyanea is a commercially important cephalopod in the Western Indian Ocean (WIO) region, but scientific information to inform management strategies for the species is limited. A …","https://www.ajol.info/index.php/wiojms/article/view/198108/199249",""
0,"AP Shoko, EE Ulotu, SD Shayo, MO Silas, S Chimatiro…","A VALUE CHAIN ANALYSIS OF AQUACULTURE INDUSTRY IN TANZANIA",,"","","","",6,"2021-11-11 22:25:51","CITATION","","","",,,,,0,0.00,0,6,,"","","https://scholar.google.com/scholar?q=related:41SDHEtGjzMJ:scholar.google.com/&scioq=author:%22silas+mathew%22&hl=en&as_sdt=2007"
