Cites,Authors,Title,Year,Source,Publisher,ArticleURL,CitesURL,GSRank,QueryDate,Type,DOI,ISSN,CitationURL,Volume,Issue,StartPage,EndPage,ECC,CitesPerYear,CitesPerAuthor,AuthorCount,Age,Abstract,FullTextURL,RelatedURL
2,"BP Ngatunga","The need to maintain maximum biodiversity in Lake Nyasa",2001,"LAKE MALAWI FISHERIES MANAGEMENT …","malawifisheries.org","http://malawifisheries.org/bitstream/handle/20.500.12364/1136/81148869417241137679066240658829990769.pdf?sequence=1&isAllowed=y#page=30","https://scholar.google.com/scholar?cites=3096198053176552531&as_sdt=2005&sciodt=2007&hl=en",33,"2021-11-12 06:35:27","PDF","","","",,,,,2,0.10,2,1,20,"Lake Nyasa fish fauna comprises more than 1 000 species, mainly cichlids, and is thus unique among freshwater lakes. But tension exists between motives either to conserve or …","http://malawifisheries.org/bitstream/handle/20.500.12364/1136/81148869417241137679066240658829990769.pdf?sequence=1&isAllowed=y#page=30","https://scholar.google.com/scholar?q=related:UyzYmbnn9yoJ:scholar.google.com/&scioq=author:%22benjamin+ngatunga%22&hl=en&as_sdt=2007"
0,"H Alzaylaee, RA Collins, G Rinaldi…","Correction: Schistosoma species detection by environmental DNA assays in African freshwaters",2020,"PLoS Neglected …","journals.plos.org","https://journals.plos.org/plosntds/article?id=10.1371/journal.pntd.0008721","",34,"2021-11-12 06:35:27","","","","",,,,,0,0.00,0,4,1,"After publication of this article [1], the authors noticed a reporting error in the results section. The species described in the first paragraph of the results sub-section 'Environmental DNA …","","https://scholar.google.com/scholar?q=related:f--ApaICadwJ:scholar.google.com/&scioq=author:%22benjamin+ngatunga%22&hl=en&as_sdt=2007"
0,"SJBJH Henry, WA Warraich, ASASR Tamatamah…","Limited hybridization between introduced and Critically Endangered indigenous tilapia fishes in northern Tanzania",,"research-information.bris.ac.uk","","https://research-information.bris.ac.uk/ws/portalfiles/portal/155175282/s10750_018_3572_5.pdf","",35,"2021-11-12 06:35:27","PDF","","","",,,,,0,0.00,0,4,,"Hybridization between introduced and indigenous species can lead to loss of unique genetic resources and precipitate extinction. In Tanzania, the Nile tilapia (Oreochromis …","https://research-information.bris.ac.uk/ws/portalfiles/portal/155175282/s10750_018_3572_5.pdf","https://scholar.google.com/scholar?q=related:NUFgr_SnWFIJ:scholar.google.com/&scioq=author:%22benjamin+ngatunga%22&hl=en&as_sdt=2007"
0,"N Okada, BP Ngatunga, POJ Bwathondi, T Sasaki…","Mitogenomic Analysis for Coelacanths (Latimeria Chalumnae) Caught in Tanzania",2007,"","196.44.162.10","http://196.44.162.10:8080/xmlui/handle/20.500.11810/3761","",36,"2021-11-12 06:35:27","","","","",,,,,0,0.00,0,5,14,"In recent years, a large number of individuals of the species Latimeria chalumnae, one of the living fossil coelacanths, have been landed off the coast of Tanzania. Although L …","",""
0,"C Rumisha, B Benno, H Kalombo…","Coelacanth (Latimeria chalumnae Smith, 1939) discoveries and conservation in Tanzania: coelacanth research",2006,"… African Journal of …","ingentaconnect.com","https://www.ingentaconnect.com/content/sabinet/sajsci/2006/00000102/00000009/art00022","",37,"2021-11-12 06:35:27","","","","",,,,,0,0.00,0,4,15,"Prior to September 2003, coelacanths had not been officially recorded from waters off Tanzania. A sudden spate of coelacanth catches has resulted in 21 confirmed and several …","",""
7,"P Tortell, B Ngatunga","Terminal evaluation of the development of Mnazi Bay-Ruvuma Estuary Marine Park (MBREMP)",2007,"Dar Es Salaam and Wellington: Government of the …","","","https://scholar.google.com/scholar?cites=3134667407227056812&as_sdt=2005&sciodt=2007&hl=en",38,"2021-11-12 06:35:27","CITATION","","","",,,,,7,0.50,4,2,14,"","","https://scholar.google.com/scholar?q=related:rHLDEGaTgCsJ:scholar.google.com/&scioq=author:%22benjamin+ngatunga%22&hl=en&as_sdt=2007"
4,"BP Ngatunga","A taxonomic revision of the shallow-water species of the genera Lethrinops, Tramitichromis and Taeniolethrinops (Teleostei, Cichlidae) from Lake Malawi …",2000,"","Rhodes University","","https://scholar.google.com/scholar?cites=2706596224138440782&as_sdt=2005&sciodt=2007&hl=en",39,"2021-11-12 06:35:27","CITATION","","","",,,,,4,0.19,4,1,21,"","","https://scholar.google.com/scholar?q=related:TnAv-uzCjyUJ:scholar.google.com/&scioq=author:%22benjamin+ngatunga%22&hl=en&as_sdt=2007"
0,"T Takahashi, B Ngatunga, J Snoeks","Lake Victoria rock cichlids. Taxonomy, ecology, and distribution Lake Victoria rock cichlids. Taxonomy, ecology, and distribution, 1996",1996,"ci.nii.ac.jp","","https://ci.nii.ac.jp/naid/10018536551/","",40,"2021-11-12 06:35:27","CITATION","","","",,,,,0,0.00,0,3,25,"CiNii 論文 - <no title> CiNii 国立情報学研究所 学術情報ナビゲータ[サイニィ] 日本の論文をさがす 大学図書館の本をさがす 日本の博士論文をさがす 新規登録 ログイン English 検索 すべて 本文あり …","",""
0,"T Takahashi, B Ngatunga, J Snoeks","Tanganyika cichlids in their natural habitat Tanganyika cichlids in their natural habitat, 1998",1998,"ci.nii.ac.jp","","https://ci.nii.ac.jp/naid/10018536543/","",41,"2021-11-12 06:35:27","CITATION","","","",,,,,0,0.00,0,3,23,"CiNii 論文 - <no title> CiNii 国立情報学研究所 学術情報ナビゲータ[サイニィ] 日本の論文をさがす 大学図書館の本をさがす 日本の博士論文をさがす 新規登録 ログイン English 検索 すべて 本文あり …","",""
0,"T Takahashi, B Ngatunga, J Snoeks","Tanganyika secrets Tanganyika secrets, 1992",1992,"ci.nii.ac.jp","","https://ci.nii.ac.jp/naid/10018536544/","",42,"2021-11-12 06:35:27","CITATION","","","",,,,,0,0.00,0,3,29,"CiNii 論文 - <no title> CiNii 国立情報学研究所 学術情報ナビゲータ[サイニィ] 日本の論文をさがす 大学図書館の本をさがす 日本の博士論文をさがす 新規登録 ログイン English 検索 すべて 本文あり …","",""
0,"T Takahashi, B Ngatunga, J Snoeks","Tanganyika cichlids Tanganyika cichlids, 1988",1988,"ci.nii.ac.jp","","https://ci.nii.ac.jp/naid/10018536542/","",43,"2021-11-12 06:35:27","CITATION","","","",,,,,0,0.00,0,3,33,"CiNii 論文 - <no title> CiNii 国立情報学研究所 学術情報ナビゲータ[サイニィ] 日本の論文をさがす 大学図書館の本をさがす 日本の博士論文をさがす 新規登録 ログイン English 検索 すべて 本文あり …","",""
0,"T Takahashi, B Ngatunga, J Snoeks","International code of zoological nomenclature International code of zoological nomenclature, 1999",1999,"ci.nii.ac.jp","","https://ci.nii.ac.jp/naid/10018536540/","",44,"2021-11-12 06:35:27","CITATION","","","",,,,,0,0.00,0,3,22,"CiNii 論文 - <no title> CiNii 国立情報学研究所 学術情報ナビゲータ[サイニィ] 日本の論文をさがす 大学図書館の本をさがす 日本の博士論文をさがす 新規登録 ログイン English 検索 すべて 本文あり …","",""
0,"BP Ngatunga","The Growth Promoting Effects of Single and Multiple Hormones Administered at Different Phases of the Photoperiod Cycle to Tilapia Mariae (Boulenger)",1985,"","University of Wales (UCNW, Bangor …","","",45,"2021-11-12 06:35:27","CITATION","","","",,,,,0,0.00,0,1,36,"","",""
