Cites,Authors,Title,Year,Source,Publisher,ArticleURL,CitesURL,GSRank,QueryDate,Type,DOI,ISSN,CitationURL,Volume,Issue,StartPage,EndPage,ECC,CitesPerYear,CitesPerAuthor,AuthorCount,Age,Abstract,FullTextURL,RelatedURL
45,"P Mziray, IA Kimirei","Bioaccumulation of heavy metals in marine fishes (Siganus sutor, Lethrinus harak, and Rastrelliger kanagurta) from Dar es Salaam Tanzania",2016,"Regional studies in marine science","Elsevier","https://www.sciencedirect.com/science/article/pii/S2352485516300780","https://scholar.google.com/scholar?cites=11011228592165348693&as_sdt=2005&sciodt=2007&hl=en",1,"2021-11-11 22:24:39","","","","",,,,,45,9.00,23,2,5,"Toxic metals that bioaccumulate and magnify along food chains are a concern to human health worldwide. This study determined heavy metal concentrations in three commercial …","https://www.academia.edu/download/46467543/Mziray_and_Kimirei_uncorrected_proofs_RSMA.pdf","https://scholar.google.com/scholar?q=related:VeWjiBC-z5gJ:scholar.google.com/&scioq=author:%22prisca+mziray%22&hl=en&as_sdt=2007"
7,"P Mziray, IA Kimirei, PA Staehr, CV Lugomela…","Seasonal patterns of thermal stratification and primary production in the northern parts of Lake Tanganyika",2018,"Journal of Great Lakes …","Elsevier","https://www.sciencedirect.com/science/article/pii/S0380133018301552","https://scholar.google.com/scholar?cites=9546416762066764986&as_sdt=2005&sciodt=2007&hl=en",2,"2021-11-11 22:24:39","","","","",,,,,7,2.33,1,5,3,"Thermal stratification in meromictic Lake Tanganyika weakens during the cool, dry and windy season, allowing intrusions of deeper nutrient-rich waters into the upper mixed layer …","","https://scholar.google.com/scholar?q=related:ugTTTHeve4QJ:scholar.google.com/&scioq=author:%22prisca+mziray%22&hl=en&as_sdt=2007"
6,"Q Gao, S Chen, IA Kimirei, L Zhang, H Mgana…","Wet deposition of atmospheric nitrogen contributes to nitrogen loading in the surface waters of Lake Tanganyika, East Africa: a case study of the Kigoma region",2018,"… Science and Pollution …","Springer","https://link.springer.com/article/10.1007/s11356-018-1389-4","https://scholar.google.com/scholar?cites=7185434536883274681&as_sdt=2005&sciodt=2007&hl=en",3,"2021-11-11 22:24:39","","10.1007/s11356-018-1389-4","","",,,,,6,2.00,1,6,3,"Abstract Lake Tanganyika, an African Great Lake, is a complex tropical ecosystem that has been subjected to extreme climate-related changes in the last century, including seasonal …","","https://scholar.google.com/scholar?q=related:uUPAJ6TKt2MJ:scholar.google.com/&scioq=author:%22prisca+mziray%22&hl=en&as_sdt=2007"
0,"J Brehm, C O'Reilly, P Stæhr…","A Transdisciplinary Examination of Food Insecurity and Sustainability on Lake Tanganyika",2019,"AGU Fall Meeting …","ui.adsabs.harvard.edu","https://ui.adsabs.harvard.edu/abs/2019AGUFMGC43H1394B/abstract","",4,"2021-11-11 22:24:39","","","","",,,,,0,0.00,0,4,2,"Sustainable environmental management of natural resources is critical for human society. The impacts of climate change, coupled with growing human populations, provide immense …","",""
0,"Q Gao, S Chen, IA Kimirei, L Zhang, H Mgana, P Mziray…","Wet deposition of atmospheric nitrogen contributes to nitrogen loading",2018,"","","","",5,"2021-11-11 22:24:39","CITATION","","","",,,,,0,0.00,0,7,3,"","",""
